{
  "$schema": "https://json-schema.org/draft/2020-12/schema",
  "$id": "https://himind.dev/contracts/agent-core/v1/connector-manifest.schema.json",
  "title": "HiMind Connector Manifest v1",
  "type": "object",
  "additionalProperties": false,
  "required": [
    "schema_version",
    "id",
    "version",
    "name",
    "availability",
    "credential_ownership",
    "auth"
  ],
  "properties": {
    "schema_version": { "const": "connector_manifest.v1" },
    "id": { "type": "string", "pattern": "^[A-Za-z0-9._-]+$" },
    "version": {
      "type": "string",
      "pattern": "^(0|[1-9][0-9]*)\\.(0|[1-9][0-9]*)\\.(0|[1-9][0-9]*)$"
    },
    "name": { "type": "string", "minLength": 1 },
    "description": { "type": "string" },
    "availability": {
      "enum": ["local", "network_service", "control_plane"]
    },
    "credential_ownership": {
      "enum": ["agent", "dashboard", "none"]
    },
    "auth": {
      "type": "array",
      "items": {
        "enum": ["none", "oauth2", "api_key", "mcp", "managed"]
      },
      "uniqueItems": true
    },
    "capabilities": {
      "type": "array",
      "items": { "type": "string", "minLength": 1 }
    },
    "scopes": {
      "type": "array",
      "items": { "type": "string", "minLength": 1 }
    },
    "supported_platforms": {
      "type": "array",
      "items": { "type": "string", "minLength": 1 }
    },
    "health_check": { "type": "object" },
    "credentials": {
      "type": "array",
      "items": {
        "type": "object",
        "additionalProperties": false,
        "required": ["handle", "target", "kind"],
        "properties": {
          "handle": { "type": "string", "minLength": 1 },
          "target": { "type": "string", "minLength": 1 },
          "kind": { "enum": ["file_path", "secret"] },
          "required": { "type": "boolean" }
        }
      }
    }
  }
}
